{
  "schemaVersion": "rigor.consultation-session.v1",
  "artifactId": "consultation-session_97e1d93a-13c7-4e1a-af69-8f7f9ff9f0ff",
  "taskId": "GH-51",
  "createdAt": "2026-07-12T14:21:52.804Z",
  "preflightArtifactId": "preflight_37c70c01-4d44-4982-ad1a-563b9867e68d",
  "preflightHash": "d76a84fc6a96305af7b600f4699e7ce8e2b3f4400cebf33e29e0588c6c52784c",
  "provider": "codex-plugin-cc",
  "mode": "adversarial-review",
  "requestedDecision": "Adversarially review the GH-51 change that makes rigor consult-decide persist each independent-review decision as an append-only review-decisions artifact. Look for correctness bugs, a broken selector-purity boundary, schema violations, exit-code regressions, or any way persistence could become an authorization to transmit or an approval. Read-only.",
  "transmissionDecision": "allowed",
  "beforeHead": "8b349ce4cec1e1dcd6ea6ec51adabfcf866c8fff",
  "beforeTreeHash": "80c1ae60aadca26d921c8af863002abd961a1b4fc0fa3942939dbff2e0981706",
  "changedPathsBefore": [
    "CHANGELOG.md",
    "README.md",
    "dist/rigor.cjs",
    "docs/orchestration.md",
    "schemas/independent-review-decision.v1.schema.json",
    "src/cli.ts",
    "test/review-selection.test.ts"
  ]
}
